<?xml version="1.0" encoding="UTF-8"?>
<FORMATO_OEGAM2_BAJA FechaCreacion="" Plataforma="" xmlns:xsi="http://www.w3.org/2001/XMLSchema-instance" xsi:noNamespaceSchemaLocation="PlantillaBajas.xsd">
  <CABECERA>
    <DATOS_GESTORIA>
      <NIF>48505575R</NIF>
      <NOMBRE>JULIO</NOMBRE>
      <PROFESIONAL>PROF</PROFESIONAL>
      <PROVINCIA>MU</PROVINCIA>
    </DATOS_GESTORIA>
  </CABECERA>
  <BAJA>
    <NUMERO_EXPEDIENTE>NUMERO_EXPEDIENTE</NUMERO_EXPEDIENTE>
    <REFERENCIA_PROPIA>REFERENCIA_PROPIA</REFERENCIA_PROPIA>
    <PROFESIONAL>PRO</PROFESIONAL>
    <FECHA_CREACION>12/05/1984</FECHA_CREACION>
    <OBSERVACIONES>OBSERVACIONES</OBSERVACIONES>
    <MOTIVO_BAJA></MOTIVO_BAJA>
    <PERMISO_CIRCULACION></PERMISO_CIRCULACION>
    <TARJETA_INSPECCION_TECNICA></TARJETA_INSPECCION_TECNICA>
    <BAJA_IMVTM></BAJA_IMVTM>
    <JUSTIFICANTE_DENUNCIA></JUSTIFICANTE_DENUNCIA>
    <DOCUMENTO_PROPIEDAD></DOCUMENTO_PROPIEDAD>
    <JUSTIFICANTE_IMVTM></JUSTIFICANTE_IMVTM>
    <DATOS_VEHICULO>
      <MATRICULA>MATRICULA</MATRICULA>
      <FECHA_MATRICULACION>12/05/1984</FECHA_MATRICULACION>
      <PROVINCIA_VEHICULO>MU</PROVINCIA_VEHICULO>
      <MUNICIPIO_VEHICULO>MU</MUNICIPIO_VEHICULO>
      <PUEBLO_VEHICULO>PUEBLO_VEHICULO</PUEBLO_VEHICULO>
      <CODIGO_POSTAL_VEHICULO>30002</CODIGO_POSTAL_VEHICULO>
      <TIPO_VIA_VEHICULO></TIPO_VIA_VEHICULO>
      <CALLE_DIRECCION_VEHICULO>CALLE_DIRECCION_VEHICULO</CALLE_DIRECCION_VEHICULO>
      <NUMERO_DIRECCION_VEHICULO>AA</NUMERO_DIRECCION_VEHICULO>
      <LETRA_DIRECCION_VEHICULO>SS</LETRA_DIRECCION_VEHICULO>
      <ESCALERA_DIRECCION_VEHICULO>2</ESCALERA_DIRECCION_VEHICULO>
      <PISO_DIRECCION_VEHICULO>3</PISO_DIRECCION_VEHICULO>
      <PUERTA_DIRECCION_VEHICULO>G</PUERTA_DIRECCION_VEHICULO>
      <BLOQUE_DIRECCION_VEHICULO>A</BLOQUE_DIRECCION_VEHICULO>
      <KM_DIRECCION_VEHICULO>100</KM_DIRECCION_VEHICULO>
      <HM_DIRECCION_VEHICULO>200</HM_DIRECCION_VEHICULO>
    </DATOS_VEHICULO>
    <DATOS_TITULAR>
      <DNI_TITULAR>48505575R</DNI_TITULAR>
      <SEXO_TITULAR></SEXO_TITULAR>
      <APELLIDO1_RAZON_SOCIAL_TITULAR>APELLIDO1_RAZON_SOCIAL_TITULAR</APELLIDO1_RAZON_SOCIAL_TITULAR>
      <APELLIDO2_TITULAR>APELLIDO2_TITULAR</APELLIDO2_TITULAR>
      <NOMBRE_TITULAR>NOMBRE_TITULAR</NOMBRE_TITULAR>
      <PROVINCIA_TITULAR>MU</PROVINCIA_TITULAR>
      <MUNICIPIO_TITULAR>MU</MUNICIPIO_TITULAR>
      <PUEBLO_TITULAR>PUEBLO_TITULAR</PUEBLO_TITULAR>
      <CODIGO_POSTAL_TITULAR>30002</CODIGO_POSTAL_TITULAR>
      <TIPO_VIA_TITULAR></TIPO_VIA_TITULAR>
      <CALLE_DIRECCION_TITULAR>CALLE_DIRECCION_TITULAR</CALLE_DIRECCION_TITULAR>
      <NUMERO_DIRECCION_TITULAR>6</NUMERO_DIRECCION_TITULAR>
      <LETRA_DIRECCION_TITULAR>A</LETRA_DIRECCION_TITULAR>
      <ESCALERA_DIRECCION_TITULAR>2</ESCALERA_DIRECCION_TITULAR>
      <PISO_DIRECCION_TITULAR>3</PISO_DIRECCION_TITULAR>
      <PUERTA_DIRECCION_TITULAR>G</PUERTA_DIRECCION_TITULAR>
      <BLOQUE_DIRECCION_TITULAR>A</BLOQUE_DIRECCION_TITULAR>
      <KM_DIRECCION_TITULAR>300</KM_DIRECCION_TITULAR>
      <HM_DIRECCION_TITULAR>500</HM_DIRECCION_TITULAR>
    </DATOS_TITULAR>
    <DATOS_REPRESENTANTE>
      <DNI_REPRESENTANTE>48505575R</DNI_REPRESENTANTE>
      <SEXO_REPRESENTANTE></SEXO_REPRESENTANTE>
      <APELLIDO1_RAZON_SOCIAL_REPRESENTANTE>APELLIDO1_RAZON_SOCIAL_REPRESENTANTE</APELLIDO1_RAZON_SOCIAL_REPRESENTANTE>
      <APELLIDO2_REPRESENTANTE>APELLIDO2_REPRESENTANTE</APELLIDO2_REPRESENTANTE>
      <NOMBRE_REPRESENTANTE>NOMBRE_REPRESENTANTE</NOMBRE_REPRESENTANTE>
      <CONCEPTO_REPRESENTANTE></CONCEPTO_REPRESENTANTE>
    </DATOS_REPRESENTANTE>
    <DATOS_ADQUIRIENTE>
      <DNI_ADQUIRIENTE>48505575R</DNI_ADQUIRIENTE>
      <SEXO_ADQUIRIENTE></SEXO_ADQUIRIENTE>
      <APELLIDO1_RAZON_SOCIAL_ADQUIRIENTE>APELLIDO1_RAZON_SOCIAL_ADQUIRIENTE</APELLIDO1_RAZON_SOCIAL_ADQUIRIENTE>
      <APELLIDO2_ADQUIRIENTE>APELLIDO2_ADQUIRIENTE</APELLIDO2_ADQUIRIENTE>
      <NOMBRE_ADQUIRIENTE>NOMBRE_ADQUIRIENTE</NOMBRE_ADQUIRIENTE>
      <FECHA_NACIMIENTO_ADQUIRIENTE>12/05/1984</FECHA_NACIMIENTO_ADQUIRIENTE>
      <PROVINCIA_ADQUIRIENTE>MU</PROVINCIA_ADQUIRIENTE>
      <MUNICIPIO_ADQUIRIENTE>MU</MUNICIPIO_ADQUIRIENTE>
      <PUEBLO_ADQUIRIENTE>PUEBLO_ADQUIRIENTE</PUEBLO_ADQUIRIENTE>
      <CODIGO_POSTAL_ADQUIRIENTE>30002</CODIGO_POSTAL_ADQUIRIENTE>
      <TIPO_VIA_ADQUIRIENTE></TIPO_VIA_ADQUIRIENTE>
      <CALLE_DIRECCION_ADQUIRIENTE>CALLE_DIRECCION_ADQUIRIENTE</CALLE_DIRECCION_ADQUIRIENTE>
      <NUMERO_DIRECCION_ADQUIRIENTE>8</NUMERO_DIRECCION_ADQUIRIENTE>
      <LETRA_DIRECCION_ADQUIRIENTE>W</LETRA_DIRECCION_ADQUIRIENTE>
      <ESCALERA_DIRECCION_ADQUIRIENTE>A</ESCALERA_DIRECCION_ADQUIRIENTE>
      <PISO_DIRECCION_ADQUIRIENTE>5</PISO_DIRECCION_ADQUIRIENTE>
      <PUERTA_DIRECCION_ADQUIRIENTE>3</PUERTA_DIRECCION_ADQUIRIENTE>
      <BLOQUE_DIRECCION_ADQUIRIENTE>a</BLOQUE_DIRECCION_ADQUIRIENTE>
      <KM_DIRECCION_ADQUIRIENTE>800</KM_DIRECCION_ADQUIRIENTE>
      <HM_DIRECCION_ADQUIRIENTE>900</HM_DIRECCION_ADQUIRIENTE>
    </DATOS_ADQUIRIENTE>
    <DATOS_PAGO_PRESENTACION>
      <CODIGO_TASA>CODIGO_TASA</CODIGO_TASA>
      <JEFATURA_PROVINCIAL>MU</JEFATURA_PROVINCIAL>
      <FECHA_PRESENTACION>12/05/1984</FECHA_PRESENTACION>
    </DATOS_PAGO_PRESENTACION>
  </BAJA>
</FORMATO_OEGAM2_BAJA>
